código,nome,nome completo,ispb
1.0,BCO DO BRASIL S.A.,Banco do Brasil S.A.,00000000
3.0,BCO DA AMAZONIA S.A.,BANCO DA AMAZONIA S.A.,04902979
4.0,BCO DO NORDESTE DO BRASIL S.A.,Banco do Nordeste do Brasil S.A.,07237373
7.0,BNDES,BANCO NACIONAL DE DESENVOLVIMENTO ECONOMICO E SOCIAL,33657248
10.0,CREDICOAMO,CREDICOAMO CREDITO RURAL COOPERATIVA,81723108
11.0,C.SUISSE HEDGING-GRIFFO CV S/A,CREDIT SUISSE HEDGING-GRIFFO CORRETORA DE VALORES S.A,61809182
12.0,BANCO INBURSA,Banco Inbursa S.A.,04866275
14.0,STATE STREET BR S.A. BCO COMERCIAL,STATE STREET BRASIL S.A. - BANCO COMERCIAL,09274232
15.0,UBS BRASIL CCTVM S.A.,"UBS Brasil Corretora de Câmbio, Títulos e Valores Mobiliários S.A.",02819125
16.0,CCM DESP TRÂNS SC E RS,COOPERATIVA DE CRÉDITO MÚTUO DOS DESPACHANTES DE TRÂNSITO DE SANTA CATARINA E RI,04715685
17.0,BNY MELLON BCO S.A.,BNY Mellon Banco S.A.,42272526
18.0,BCO TRICURY S.A.,Banco Tricury S.A.,57839805
21.0,BCO BANESTES S.A.,BANESTES S.A. BANCO DO ESTADO DO ESPIRITO SANTO,28127603
24.0,BCO BANDEPE S.A.,Banco Bandepe S.A.,10866788
25.0,BCO ALFA S.A.,Banco Alfa S.A.,03323840
29.0,BANCO ITAÚ CONSIGNADO S.A.,Banco Itaú Consignado S.A.,33885724
33.0,BCO SANTANDER (BRASIL) S.A.,BANCO SANTANDER (BRASIL) S.A.,90400888
36.0,BCO BBI S.A.,Banco Bradesco BBI S.A.,06271464
37.0,BCO DO EST. DO PA S.A.,Banco do Estado do Pará S.A.,04913711
40.0,BCO CARGILL S.A.,Banco Cargill S.A.,03609817
41.0,BCO DO ESTADO DO RS S.A.,Banco do Estado do Rio Grande do Sul S.A.,92702067
47.0,BCO DO EST. DE SE S.A.,Banco do Estado de Sergipe S.A.,13009717
60.0,CONFIDENCE CC S.A.,Confidence Corretora de Câmbio S.A.,04913129
62.0,HIPERCARD BM S.A.,Hipercard Banco Múltiplo S.A.,03012230
63.0,BANCO BRADESCARD,Banco Bradescard S.A.,04184779
64.0,GOLDMAN SACHS DO BRASIL BM S.A,GOLDMAN SACHS DO BRASIL BANCO MULTIPLO S.A.,04332281
65.0,BCO ANDBANK S.A.,Banco AndBank (Brasil) S.A.,48795256
66.0,BCO MORGAN STANLEY S.A.,BANCO MORGAN STANLEY S.A.,02801938
69.0,BCO CREFISA S.A.,Banco Crefisa S.A.,61033106
70.0,BRB - BCO DE BRASILIA S.A.,BRB - BANCO DE BRASILIA S.A.,00000208
74.0,BCO. J.SAFRA S.A.,Banco J. Safra S.A.,03017677
75.0,BCO ABN AMRO S.A.,Banco ABN Amro S.A.,03532415
76.0,BCO KDB BRASIL S.A.,Banco KDB do Brasil S.A.,07656500
77.0,BANCO INTER,Banco Inter S.A.,00416968
78.0,HAITONG BI DO BRASIL S.A.,Haitong Banco de Investimento do Brasil S.A.,34111187
79.0,PICPAY BANK - BANCO MÚLTIPLO S.A,PICPAY BANK - BANCO MÚLTIPLO S.A,09516419
80.0,B&T CC LTDA.,B&T CORRETORA DE CAMBIO LTDA.,73622748
81.0,BANCOSEGURO S.A.,BancoSeguro S.A.,10264663
82.0,BANCO TOPÁZIO S.A.,BANCO TOPÁZIO S.A.,07679404
83.0,BCO DA CHINA BRASIL S.A.,Banco da China Brasil S.A.,10690848
84.0,SISPRIME DO BRASIL - COOP,SISPRIME DO BRASIL - COOPERATIVA DE CRÉDITO,02398976
85.0,COOPCENTRAL AILOS,Cooperativa Central de Crédito - Ailos,05463212
88.0,BANCO RANDON S.A.,BANCO RANDON S.A.,11476673
89.0,CREDISAN CC,CREDISAN COOPERATIVA DE CRÉDITO,62109566
93.0,POLOCRED SCMEPP LTDA.,PÓLOCRED   SOCIEDADE DE CRÉDITO AO MICROEMPREENDEDOR E À EMPRESA DE PEQUENO PORT,07945233
94.0,BANCO FINAXIS,Banco Finaxis S.A.,11758741
95.0,TRAVELEX BANCO DE CÂMBIO S.A.,Travelex Banco de Câmbio S.A.,11703662
96.0,BCO B3 S.A.,Banco B3 S.A.,00997185
97.0,CREDISIS CENTRAL DE COOPERATIVAS DE CRÉDITO LTDA.,Credisis - Central de Cooperativas de Crédito Ltda.,04632856
98.0,CREDIALIANÇA CCR,Credialiança Cooperativa de Crédito Rural,78157146
99.0,UNIPRIME COOPCENTRAL LTDA.,UNIPRIME CENTRAL NACIONAL - CENTRAL NACIONAL DE COOPERATIVA DE CREDITO,03046391
100.0,PLANNER CV S.A.,Planner Corretora de Valores S.A.,00806535
101.0,RENASCENCA DTVM LTDA,RENASCENCA DISTRIBUIDORA DE TÍTULOS E VALORES MOBILIÁRIOS LTDA,62287735
102.0,XP INVESTIMENTOS CCTVM S/A,"XP INVESTIMENTOS CORRETORA DE CÂMBIO,TÍTULOS E VALORES MOBILIÁRIOS S/A",02332886
104.0,CAIXA ECONOMICA FEDERAL,CAIXA ECONOMICA FEDERAL,00360305
105.0,LECCA CFI S.A.,"Lecca Crédito, Financiamento e Investimento S/A",07652226
107.0,BCO BOCOM BBM S.A.,Banco Bocom BBM S.A.,15114366
111.0,OLIVEIRA TRUST DTVM S.A.,OLIVEIRA TRUST DISTRIBUIDORA DE TÍTULOS E VALORES MOBILIARIOS S.A.,36113876
113.0,NEON CTVM S.A.,NEON CORRETORA DE TÍTULOS E VALORES MOBILIÁRIOS S.A.,61723847
114.0,CENTRAL COOPERATIVA DE CRÉDITO NO ESTADO DO ESPÍRITO SANTO,Central Cooperativa de Crédito no Estado do Espírito Santo - CECOOP,05790149
117.0,ADVANCED CC LTDA,ADVANCED CORRETORA DE CÂMBIO LTDA,92856905
119.0,BCO WESTERN UNION,Banco Western Union do Brasil S.A.,13720915
120.0,BCO RODOBENS S.A.,BANCO RODOBENS S.A.,33603457
121.0,BCO AGIBANK S.A.,Banco Agibank S.A.,10664513
122.0,BCO BRADESCO BERJ S.A.,Banco Bradesco BERJ S.A.,33147315
124.0,BCO WOORI BANK DO BRASIL S.A.,Banco Woori Bank do Brasil S.A.,15357060
125.0,BANCO GENIAL,BANCO GENIAL S.A.,45246410
126.0,BR PARTNERS BI,BR Partners Banco de Investimento S.A.,13220493
127.0,CODEPE CVC S.A.,Codepe Corretora de Valores e Câmbio S.A.,09512542
128.0,BRAZA BANK S.A. BCO DE CÂMBIO,BRAZA BANK S.A. BANCO DE CÂMBIO,19307785
129.0,UBS BRASIL BI S.A.,UBS Brasil Banco de Investimento S.A.,18520834
130.0,CARUANA SCFI,"CARUANA S.A. - SOCIEDADE DE CRÉDITO, FINANCIAMENTO E INVESTIMENTO",09313766
131.0,TULLETT PREBON BRASIL CVC LTDA,TULLETT PREBON BRASIL CORRETORA DE VALORES E CÂMBIO LTDA,61747085
132.0,ICBC DO BRASIL BM S.A.,ICBC do Brasil Banco Múltiplo S.A.,17453575
133.0,CRESOL CONFEDERAÇÃO,CONFEDERAÇÃO NACIONAL DAS COOPERATIVAS CENTRAIS DE CRÉDITO E ECONOMIA FAMILIAR E,10398952
134.0,BGC LIQUIDEZ DTVM LTDA,BGC LIQUIDEZ DISTRIBUIDORA DE TÍTULOS E VALORES MOBILIÁRIOS LTDA,33862244
136.0,CONF NAC COOP CENTRAIS UNICRED,CONFEDERAÇÃO NACIONAL DAS COOPERATIVAS CENTRAIS UNICRED LTDA. - UNICRED DO BRASI,00315557
138.0,GET MONEY CC LTDA,Get Money Corretora de Câmbio S.A.,10853017
139.0,INTESA SANPAOLO BRASIL S.A. BM,Intesa Sanpaolo Brasil S.A. - Banco Múltiplo,55230916
140.0,NU INVEST CORRETORA DE VALORES S.A.,NU INVEST CORRETORA DE VALORES S.A.,62169875
141.0,MASTER BI S.A.,BANCO MASTER DE INVESTIMENTO S.A.,09526594
142.0,BROKER BRASIL CC LTDA.,Broker Brasil Corretora de Câmbio Ltda.,16944141
143.0,TREVISO CC S.A.,Treviso Corretora de Câmbio S.A.,02992317
144.0,BEXS BCO DE CAMBIO S.A.,BEXS BANCO DE CÂMBIO S/A,13059145
145.0,LEVYCAM CCV LTDA,LEVYCAM - CORRETORA DE CAMBIO E VALORES LTDA.,50579044
146.0,GUITTA CC LTDA,GUITTA CORRETORA DE CAMBIO LTDA.,24074692
149.0,FACTA S.A. CFI,Facta Financeira S.A. - Crédito Financiamento e Investimento,15581638
157.0,ICAP DO BRASIL CTVM LTDA.,ICAP do Brasil Corretora de Títulos e Valores Mobiliários Ltda.,09105360
159.0,CASA CREDITO S.A. SCM,Casa do Crédito S.A. Sociedade de Crédito ao Microempreendedor,05442029
173.0,BRL TRUST DTVM SA,BRL Trust Distribuidora de Títulos e Valores Mobiliários S.A.,13486793
174.0,PEFISA S.A. - C.F.I.,"PEFISA S.A. - CRÉDITO, FINANCIAMENTO E INVESTIMENTO",43180355
177.0,GUIDE,Guide Investimentos S.A. Corretora de Valores,65913436
180.0,CM CAPITAL MARKETS CCTVM LTDA,"CM CAPITAL MARKETS CORRETORA DE CÂMBIO, TÍTULOS E VALORES MOBILIÁRIOS LTDA",02685483
183.0,SOCRED SA - SCMEPP,SOCRED S.A. - SOCIEDADE DE CRÉDITO AO MICROEMPREENDEDOR E À EMPRESA DE PEQUENO P,09210106
184.0,BCO ITAÚ BBA S.A.,Banco Itaú BBA S.A.,17298092
188.0,ATIVA S.A. INVESTIMENTOS CCTVM,"ATIVA INVESTIMENTOS S.A. CORRETORA DE TÍTULOS, CÂMBIO E VALORES",33775974
189.0,HS FINANCEIRA,"HS FINANCEIRA S/A CREDITO, FINANCIAMENTO E INVESTIMENTOS",07512441
190.0,SERVICOOP,SERVICOOP - COOPERATIVA DE CRÉDITO DOS SERVIDORES PÚBLICOS ESTADUAIS E MUNICIPAI,03973814
191.0,NOVA FUTURA CTVM LTDA.,Nova Futura Corretora de Títulos e Valores Mobiliários Ltda.,04257795
194.0,PARMETAL DTVM LTDA,PARMETAL DISTRIBUIDORA DE TÍTULOS E VALORES MOBILIÁRIOS LTDA,20155248
195.0,VALOR SCD S.A.,VALOR SOCIEDADE DE CRÉDITO DIRETO S.A.,07799277
196.0,FAIR CC S.A.,FAIR CORRETORA DE CAMBIO S.A.,32648370
197.0,STONE IP S.A.,STONE INSTITUIÇÃO DE PAGAMENTO S.A.,16501555
208.0,BANCO BTG PACTUAL S.A.,Banco BTG Pactual S.A.,30306294
212.0,BANCO ORIGINAL,Banco Original S.A.,92894922
213.0,BCO ARBI S.A.,Banco Arbi S.A.,54403563
217.0,BANCO JOHN DEERE S.A.,Banco John Deere S.A.,91884981
218.0,BCO BS2 S.A.,Banco BS2 S.A.,71027866
222.0,BCO CRÉDIT AGRICOLE BR S.A.,BANCO CRÉDIT AGRICOLE BRASIL S.A.,75647891
224.0,BCO FIBRA S.A.,Banco Fibra S.A.,58616418
233.0,BANCO CIFRA,Banco Cifra S.A.,62421979
237.0,BCO BRADESCO S.A.,Banco Bradesco S.A.,60746948
241.0,BCO CLASSICO S.A.,BANCO CLASSICO S.A.,31597552
243.0,BANCO MASTER,BANCO MASTER S/A,33923798
246.0,BCO ABC BRASIL S.A.,Banco ABC Brasil S.A.,28195667
249.0,BANCO INVESTCRED UNIBANCO S.A.,Banco Investcred Unibanco S.A.,61182408
250.0,"BCV - BCO, CRÉDITO E VAREJO S.A.",BCV - BANCO DE CRÉDITO E VAREJO S.A.,50585090
253.0,BEXS CC S.A.,Bexs Corretora de Câmbio S/A,52937216
254.0,PARANA BCO S.A.,PARANÁ BANCO S.A.,14388334
259.0,MONEYCORP BCO DE CÂMBIO S.A.,MONEYCORP BANCO DE CÂMBIO S.A.,08609934
260.0,NU PAGAMENTOS - IP,NU PAGAMENTOS S.A. - INSTITUIÇÃO DE PAGAMENTO,18236120
265.0,BCO FATOR S.A.,Banco Fator S.A.,33644196
266.0,BCO CEDULA S.A.,BANCO CEDULA S.A.,33132044
268.0,BARI CIA HIPOTECÁRIA,BARI COMPANHIA HIPOTECÁRIA,14511781
269.0,BCO HSBC S.A.,BANCO HSBC S.A.,53518684
270.0,SAGITUR CC,SAGITUR CORRETORA DE CÂMBIO S.A.,61444949
271.0,IB CCTVM S.A.,"IB Corretora de Câmbio, Títulos e Valores Mobiliários S.A.",27842177
272.0,AGK CC S.A.,AGK CORRETORA DE CAMBIO S.A.,00250699
273.0,CCR DE SÃO MIGUEL DO OESTE,Cooperativa de Crédito Rural de São Miguel do Oeste - Sulcredi/São Miguel,08253539
274.0,BMP SCMEPP LTDA,BMP SOCIEDADE DE CRÉDITO AO MICROEMPREENDEDOR E A EMPRESA DE PEQUENO PORTE LTDA.,11581339
276.0,BCO SENFF S.A.,BANCO SENFF S.A.,11970623
278.0,GENIAL INVESTIMENTOS CVM S.A.,Genial Investimentos Corretora de Valores Mobiliários S.A.,27652684
279.0,COOP DE PRIMAVERA DO LESTE,PRIMACREDI COOPERATIVA DE CRÉDITO DE PRIMAVERA DO LESTE,26563270
280.0,WILL FINANCEIRA S.A.CFI,"WILL FINANCEIRA S.A. CRÉDITO, FINANCIAMENTO E INVESTIMENTO",23862762
281.0,CCR COOPAVEL,Cooperativa de Crédito Rural Coopavel,76461557
283.0,RB INVESTIMENTOS DTVM LTDA.,RB INVESTIMENTOS DISTRIBUIDORA DE TITULOS E VALORES MOBILIARIOS LIMITADA,89960090
285.0,FRENTE CC S.A.,FRENTE CORRETORA DE CÂMBIO S.A.,71677850
288.0,CAROL DTVM LTDA.,CAROL DISTRIBUIDORA DE TITULOS E VALORES MOBILIARIOS LTDA.,62237649
289.0,EFX CC LTDA.,EFX CORRETORA DE CÂMBIO LTDA.,94968518
290.0,PAGSEGURO INTERNET IP S.A.,PAGSEGURO INTERNET INSTITUIÇÃO DE PAGAMENTO S.A.,08561701
292.0,BS2 DTVM S.A.,BS2 Distribuidora de Títulos e Valores Mobiliários S.A.,28650236
293.0,LASTRO RDV DTVM LTDA,Lastro RDV Distribuidora de Títulos e Valores Mobiliários Ltda.,71590442
296.0,OZ CORRETORA DE CÂMBIO S.A.,OZ CORRETORA DE CÂMBIO S.A.,04062902
298.0,VIPS CC LTDA.,Vip's Corretora de Câmbio Ltda.,17772370
299.0,BCO AFINZ S.A. - BM,BANCO AFINZ S.A. - BANCO MÚLTIPLO,04814563
300.0,BCO LA NACION ARGENTINA,Banco de la Nacion Argentina,33042151
301.0,DOCK IP S.A.,DOCK INSTITUIÇÃO DE PAGAMENTO S.A.,13370835
306.0,PORTOPAR DTVM LTDA,PORTOPAR DISTRIBUIDORA DE TITULOS E VALORES MOBILIARIOS LTDA.,40303299
307.0,TERRA INVESTIMENTOS DTVM,Terra Investimentos Distribuidora de Títulos e Valores Mobiliários Ltda.,03751794
309.0,CAMBIONET CC LTDA,CAMBIONET CORRETORA DE CÂMBIO LTDA.,14190547
310.0,VORTX DTVM LTDA.,VORTX DISTRIBUIDORA DE TITULOS E VALORES MOBILIARIOS LTDA.,22610500
311.0,DOURADA CORRETORA,DOURADA CORRETORA DE CÂMBIO LTDA.,76641497
312.0,HSCM SCMEPP LTDA.,HSCM - SOCIEDADE DE CRÉDITO AO MICROEMPREENDEDOR E À EMPRESA DE PEQUENO PORTE LT,07693858
313.0,AMAZÔNIA CC LTDA.,AMAZÔNIA CORRETORA DE CÂMBIO LTDA.,16927221
318.0,BCO BMG S.A.,Banco BMG S.A.,61186680
319.0,OM DTVM LTDA,OM DISTRIBUIDORA DE TÍTULOS E VALORES MOBILIÁRIOS LTDA,11495073
320.0,BCO CCB BRASIL S.A.,China Construction Bank (Brasil) Banco Múltiplo S/A,07450604
321.0,CREFAZ SCMEPP LTDA,CREFAZ SOCIEDADE DE CRÉDITO AO MICROEMPREENDEDOR E A EMPRESA DE PEQUENO PORTE LT,18188384
322.0,CCR DE ABELARDO LUZ,Cooperativa de Crédito Rural de Abelardo Luz - Sulcredi/Crediluz,01073966
323.0,MERCADO PAGO IP LTDA.,MERCADO PAGO INSTITUIÇÃO DE PAGAMENTO LTDA.,10573521
324.0,CARTOS SCD S.A.,CARTOS SOCIEDADE DE CRÉDITO DIRETO S.A.,21332862
325.0,ÓRAMA DTVM S.A.,Órama Distribuidora de Títulos e Valores Mobiliários S.A.,13293225
326.0,PARATI - CFI S.A.,"PARATI - CREDITO, FINANCIAMENTO E INVESTIMENTO S.A.",03311443
328.0,CECM FABRIC CALÇADOS SAPIRANGA,COOPERATIVA DE ECONOMIA E CRÉDITO MÚTUO DOS FABRICANTES DE CALÇADOS DE SAPIRANGA,05841967
329.0,QI SCD S.A.,QI Sociedade de Crédito Direto S.A.,32402502
330.0,BANCO BARI S.A.,BANCO BARI DE INVESTIMENTOS E FINANCIAMENTOS S.A.,00556603
331.0,FRAM CAPITAL DTVM S.A.,Fram Capital Distribuidora de Títulos e Valores Mobiliários S.A.,13673855
332.0,ACESSO SOLUÇÕES DE PAGAMENTO S.A. - INSTITUIÇÃO DE PAGAMENTO,ACESSO SOLUÇÕES DE PAGAMENTO S.A. - INSTITUIÇÃO DE PAGAMENTO,13140088
334.0,BANCO BESA S.A.,BANCO BESA S.A.,15124464
335.0,BANCO DIGIO,Banco Digio S.A.,27098060
336.0,BCO C6 S.A.,Banco C6 S.A.,31872495
340.0,SUPERDIGITAL I.P. S.A.,SUPERDIGITAL INSTITUIÇÃO DE PAGAMENTO S.A.,09554480
341.0,ITAÚ UNIBANCO S.A.,ITAÚ UNIBANCO S.A.,60701190
342.0,CREDITAS SCD,Creditas Sociedade de Crédito Direto S.A.,32997490
343.0,FFA SCMEPP LTDA.,FFA SOCIEDADE DE CRÉDITO AO MICROEMPREENDEDOR E À EMPRESA DE PEQUENO PORTE LTDA.,24537861
348.0,BCO XP S.A.,Banco XP S.A.,33264668
349.0,AL5 S.A. CFI,"AL5 S.A. CRÉDITO, FINANCIAMENTO E INVESTIMENTO",27214112
350.0,CREHNOR LARANJEIRAS,COOPERATIVA DE CRÉDITO RURAL DE PEQUENOS AGRICULTORES E DA REFORMA AGRÁRIA DO CE,01330387
352.0,TORO CTVM S.A.,TORO CORRETORA DE TÍTULOS E VALORES MOBILIÁRIOS S.A.,29162769
355.0,ÓTIMO SCD S.A.,ÓTIMO SOCIEDADE DE CRÉDITO DIRETO S.A.,34335592
358.0,MIDWAY S.A. - SCFI,"MIDWAY S.A. - CRÉDITO, FINANCIAMENTO E INVESTIMENTO",09464032
359.0,ZEMA CFI S/A,"ZEMA CRÉDITO, FINANCIAMENTO E INVESTIMENTO S/A",05351887
360.0,TRINUS CAPITAL DTVM,TRINUS CAPITAL DISTRIBUIDORA DE TÍTULOS E VALORES MOBILIÁRIOS S.A.,02276653
362.0,CIELO IP S.A.,CIELO S.A. - INSTITUIÇÃO DE PAGAMENTO,01027058
363.0,SINGULARE CTVM S.A.,SINGULARE CORRETORA DE TÍTULOS E VALORES MOBILIÁRIOS S.A.,62285390
364.0,EFÍ S.A. - IP,EFÍ S.A. - INSTITUIÇÃO DE PAGAMENTO,09089356
365.0,SIMPAUL,SIMPAUL CORRETORA DE CAMBIO E VALORES MOBILIARIOS  S.A.,68757681
366.0,BCO SOCIETE GENERALE BRASIL,BANCO SOCIETE GENERALE BRASIL S.A.,61533584
367.0,VITREO DTVM S.A.,VITREO DISTRIBUIDORA DE TÍTULOS E VALORES MOBILIÁRIOS S.A.,34711571
368.0,BCO CSF S.A.,Banco CSF S.A.,08357240
370.0,BCO MIZUHO S.A.,Banco Mizuho do Brasil S.A.,61088183
371.0,WARREN CVMC LTDA,WARREN CORRETORA DE VALORES MOBILIÁRIOS E CÂMBIO LTDA.,92875780
373.0,UP.P SEP S.A.,UP.P SOCIEDADE DE EMPRÉSTIMO ENTRE PESSOAS S.A.,35977097
374.0,REALIZE CFI S.A.,"REALIZE CRÉDITO, FINANCIAMENTO E INVESTIMENTO S.A.",27351731
376.0,BCO J.P. MORGAN S.A.,BANCO J.P. MORGAN S.A.,33172537
377.0,BMS SCD S.A.,BMS SOCIEDADE DE CRÉDITO DIRETO S.A.,17826860
378.0,BCO BRASILEIRO DE CRÉDITO S.A.,BANCO BRASILEIRO DE CRÉDITO SOCIEDADE ANÔNIMA,01852137
379.0,CECM COOPERFORTE,COOPERFORTE - COOPERATIVA DE ECONOMIA E CRÉDITO MÚTUO DE FUNCIONÁRIOS DE INSTITU,01658426
380.0,PICPAY,PICPAY INSTITUIçãO DE PAGAMENTO S.A.,22896431
381.0,BCO MERCEDES-BENZ S.A.,BANCO MERCEDES-BENZ DO BRASIL S.A.,60814191
382.0,FIDUCIA SCMEPP LTDA,FIDÚCIA SOCIEDADE DE CRÉDITO AO MICROEMPREENDEDOR E À EMPRESA DE PEQUENO PORTE L,04307598
383.0,EBANX IP LTDA.,EBANX INSTITUICAO DE PAGAMENTOS LTDA.,21018182
384.0,GLOBAL SCM LTDA,GLOBAL FINANÇAS SOCIEDADE DE CRÉDITO AO MICROEMPREENDEDOR E À EMPRESA DE PEQUENO,11165756
385.0,CECM DOS TRAB.PORT. DA G.VITOR,COOPERATIVA DE ECONOMIA E CREDITO MUTUO DOS TRABALHADORES PORTUARIOS DA GRANDE V,03844699
386.0,NU FINANCEIRA S.A. CFI,"NU FINANCEIRA S.A. - Sociedade de Crédito, Financiamento e Investimento",30680829
387.0,BCO TOYOTA DO BRASIL S.A.,Banco Toyota do Brasil S.A.,03215790
389.0,BCO MERCANTIL DO BRASIL S.A.,Banco Mercantil do Brasil S.A.,17184037
390.0,BCO GM S.A.,BANCO GM S.A.,59274605
391.0,CCR DE IBIAM,COOPERATIVA DE CREDITO RURAL DE IBIAM - SULCREDI/IBIAM,08240446
393.0,BCO VOLKSWAGEN S.A,Banco Volkswagen S.A.,59109165
394.0,BCO BRADESCO FINANC. S.A.,Banco Bradesco Financiamentos S.A.,07207996
395.0,F D GOLD DTVM LTDA,F.D'GOLD - DISTRIBUIDORA DE TÍTULOS E VALORES MOBILIÁRIOS LTDA.,08673569
396.0,HUB IP S.A.,HUB INSTITUIÇÃO DE PAGAMENTO S.A.,13884775
397.0,LISTO SCD S.A.,LISTO SOCIEDADE DE CREDITO DIRETO S.A.,34088029
398.0,IDEAL CTVM S.A.,IDEAL CORRETORA DE TÍTULOS E VALORES MOBILIÁRIOS S.A.,31749596
399.0,KIRTON BANK,Kirton Bank S.A. - Banco Múltiplo,01701201
400.0,COOP CREDITAG,"COOPERATIVA DE CRÉDITO, POUPANÇA E SERVIÇOS FINANCEIROS DO CENTRO OESTE - CREDIT",05491616
401.0,IUGU IP S.A.,IUGU INSTITUIÇÃO DE PAGAMENTO S.A.,15111975
402.0,COBUCCIO S.A. SCFI,"COBUCCIO S/A - SOCIEDADE DE CRÉDITO, FINANCIAMENTO E INVESTIMENTOS",36947229
403.0,CORA SCD S.A.,CORA SOCIEDADE DE CRÉDITO DIRETO S.A.,37880206
404.0,SUMUP SCD S.A.,SUMUP SOCIEDADE DE CRÉDITO DIRETO S.A.,37241230
406.0,ACCREDITO SCD S.A.,ACCREDITO - SOCIEDADE DE CRÉDITO DIRETO S.A.,37715993
407.0,ÍNDIGO INVESTIMENTOS DTVM LTDA.,ÍNDIGO INVESTIMENTOS DISTRIBUIDORA DE TÍTULOS E VALORES MOBILIÁRIOS LTDA.,00329598
408.0,BONUSPAGO SCD S.A.,BONUSPAGO SOCIEDADE DE CRÉDITO DIRETO S.A.,36586946
410.0,PLANNER SOCIEDADE DE CRÉDITO DIRETO,PLANNER SOCIEDADE DE CRÉDITO DIRETO S.A.,05684234
411.0,VIA CERTA FINANCIADORA S.A. - CFI,"Via Certa Financiadora S.A. - Crédito, Financiamento e Investimentos",05192316
412.0,SOCIAL BANK S/A,SOCIAL BANK BANCO MÚLTIPLO S/A,15173776
413.0,BCO BV S.A.,BANCO BV S.A.,01858774
414.0,LEND SCD S.A.,LEND SOCIEDADE DE CRÉDITO DIRETO S.A.,37526080
416.0,LAMARA SCD S.A.,LAMARA SOCIEDADE DE CRÉDITO DIRETO S.A.,19324634
418.0,ZIPDIN SCD S.A.,ZIPDIN SOLUÇÕES DIGITAIS SOCIEDADE DE CRÉDITO DIRETO S/A,37414009
419.0,NUMBRS SCD S.A.,NUMBRS SOCIEDADE DE CRÉDITO DIRETO S.A.,38129006
421.0,CC LAR CREDI,LAR COOPERATIVA DE CRÉDITO - LAR CREDI,39343350
422.0,BCO SAFRA S.A.,Banco Safra S.A.,58160789
423.0,COLUNA S.A. DTVM,COLUNA S/A DISTRIBUIDORA DE TITULOS E VALORES MOBILIÁRIOS,00460065
425.0,SOCINAL S.A. CFI,"SOCINAL S.A. - CRÉDITO, FINANCIAMENTO E INVESTIMENTO",03881423
426.0,NEON FINANCEIRA - CFI S.A.,"NEON FINANCEIRA - CRÉDITO, FINANCIAMENTO E INVESTIMENTO S.A.",11285104
427.0,CRED-UFES,COOPERATIVA DE CREDITO DOS SERVIDORES DA UNIVERSIDADE FEDERAL DO ESPIRITO SANTO,27302181
428.0,CREDSYSTEM SCD S.A.,CREDSYSTEM SOCIEDADE DE CRÉDITO DIRETO S.A.,39664698
429.0,CREDIARE CFI S.A.,"Crediare S.A. - Crédito, financiamento e investimento",05676026
430.0,CCR SEARA,COOPERATIVA DE CREDITO RURAL SEARA - CREDISEARA,00204963
433.0,BR-CAPITAL DTVM S.A.,BR-CAPITAL DISTRIBUIDORA DE TÍTULOS E VALORES MOBILIÁRIOS S.A.,44077014
435.0,DELCRED SCD S.A.,DELCRED SOCIEDADE DE CRÉDITO DIRETO S.A.,38224857
438.0,TRUSTEE DTVM LTDA.,TRUSTEE DISTRIBUIDORA DE TÍTULOS E VALORES MOBILIÁRIOS LTDA.,67030395
439.0,ID CTVM,ID CORRETORA DE TÍTULOS E VALORES MOBILIÁRIOS S.A.,16695922
440.0,CREDIBRF COOP,CREDIBRF - COOPERATIVA DE CRÉDITO,82096447
442.0,MAGNETIS - DTVM,MAGNETIS - DISTRIBUIDORA DE TÍTULOS E VALORES MOBILIÁRIOS LTDA,87963450
443.0,CREDIHOME SCD,CREDIHOME SOCIEDADE DE CRÉDITO DIRETO S.A.,39416705
444.0,TRINUS SCD S.A.,TRINUS SOCIEDADE DE CRÉDITO DIRETO S.A.,40654622
445.0,PLANTAE CFI,"PLANTAE S.A. - CRÉDITO, FINANCIAMENTO E INVESTIMENTO",35551187
447.0,MIRAE ASSET CCTVM LTDA,"MIRAE ASSET WEALTH MANAGEMENT (BRAZIL) CORRETORA DE CÂMBIO, TÍTULOS E VALORES MO",12392983
448.0,HEMERA DTVM LTDA.,HEMERA DISTRIBUIDORA DE TÍTULOS E VALORES MOBILIÁRIOS LTDA.,39669186
449.0,DM,DM SOCIEDADE DE CRÉDITO DIRETO S.A.,37555231
450.0,FITBANK IP,FITBANK INSTITUIÇÃO DE PAGAMENTOS ELETRÔNICOS S.A.,13203354
451.0,J17 - SCD S/A,J17 - SOCIEDADE DE CRÉDITO DIRETO S/A,40475846
452.0,CREDIFIT SCD S.A.,CREDIFIT SOCIEDADE DE CRÉDITO DIRETO S.A.,39676772
454.0,MÉRITO DTVM LTDA.,MÉRITO DISTRIBUIDORA DE TÍTULOS E VALORES MOBILIÁRIOS LTDA.,41592532
455.0,FÊNIX DTVM LTDA.,FÊNIX DISTRIBUIDORA DE TÍTULOS E VALORES MOBILIÁRIOS LTDA.,38429045
456.0,BCO MUFG BRASIL S.A.,Banco MUFG Brasil S.A.,60498557
457.0,UY3 SCD S/A,UY3 SOCIEDADE DE CRÉDITO DIRETO S/A,39587424
458.0,HEDGE INVESTMENTS DTVM LTDA.,HEDGE INVESTMENTS DISTRIBUIDORA DE TÍTULOS E VALORES MOBILIÁRIOS LTDA.,07253654
459.0,CCM SERV. PÚBLICOS SP,COOPERATIVA DE CRÉDITO MÚTUO DE SERVIDORES PÚBLICOS DO ESTADO DE SÃO PAULO - CRE,04546162
460.0,UNAVANTI SCD S/A,UNAVANTI SOCIEDADE DE CRÉDITO DIRETO S/A,42047025
461.0,ASAAS IP S.A.,ASAAS GESTÃO FINANCEIRA INSTITUIÇÃO DE PAGAMENTO S.A.,19540550
462.0,STARK SCD S.A.,STARK SOCIEDADE DE CRÉDITO DIRETO S.A.,39908427
463.0,AZUMI DTVM,AZUMI DISTRIBUIDORA DE TíTULOS E VALORES MOBILIáRIOS LTDA.,40434681
464.0,BCO SUMITOMO MITSUI BRASIL S.A.,Banco Sumitomo Mitsui Brasileiro S.A.,60518222
465.0,CAPITAL CONSIG SCD S.A.,CAPITAL CONSIG SOCIEDADE DE CRÉDITO DIRETO S.A.,40083667
467.0,MASTER S/A CCTVM,"MASTER S/A CORRETORA DE CâMBIO, TíTULOS E VALORES MOBILIáRIOS",33886862
468.0,PORTOSEG S.A. CFI,"PORTOSEG S.A. - CREDITO, FINANCIAMENTO E INVESTIMENTO",04862600
469.0,LIGA INVEST DTVM LTDA.,LIGA INVEST DISTRIBUIDORA DE TÍTULOS E VALORES MOBILIÁRIOS LTDA,07138049
470.0,CDC SCD S.A.,CDC SOCIEDADE DE CRÉDITO DIRETO S.A.,18394228
471.0,CECM SERV PUBL PINHÃO,COOPERATIVA DE ECONOMIA E CREDITO MUTUO DOS SERVIDORES PUBLICOS DE PINHÃO - CRES,04831810
473.0,BCO CAIXA GERAL BRASIL S.A.,Banco Caixa Geral - Brasil S.A.,33466988
475.0,BCO YAMAHA MOTOR S.A.,Banco Yamaha Motor do Brasil S.A.,10371492
477.0,CITIBANK N.A.,Citibank N.A.,33042953
478.0,GAZINCRED S.A. SCFI,"GAZINCRED S.A. SOCIEDADE DE CRÉDITO, FINANCIAMENTO E INVESTIMENTO",11760553
479.0,BCO ITAUBANK S.A.,Banco ItauBank S.A.,60394079
481.0,SUPERLÓGICA SCD S.A.,SUPERLÓGICA SOCIEDADE DE CRÉDITO DIRETO S.A.,43599047
482.0,SBCASH SCD,SBCASH SOCIEDADE DE CRÉDITO DIRETO S.A.,42259084
484.0,MAF DTVM SA,MAF DISTRIBUIDORA DE TÍTULOS E VALORES MOBILIÁRIOS S.A.,36864992
487.0,DEUTSCHE BANK S.A.BCO ALEMAO,DEUTSCHE BANK S.A. - BANCO ALEMAO,62331228
488.0,JPMORGAN CHASE BANK,"JPMorgan Chase Bank, National Association",46518205
495.0,BCO LA PROVINCIA B AIRES BCE,Banco de La Provincia de Buenos Aires,44189447
505.0,BCO CREDIT SUISSE S.A.,Banco Credit Suisse (Brasil) S.A.,32062580
506.0,RJI,RJI CORRETORA DE TITULOS E VALORES MOBILIARIOS LTDA,42066258
507.0,SCFI EFÍ S.A.,"SOCIEDADE DE CRÉDITO, FINANCIAMENTO E INVESTIMENTO EFÍ S.A.",37229413
508.0,AVENUE SECURITIES DTVM LTDA.,AVENUE SECURITIES DISTRIBUIDORA DE TÍTULOS E VALORES MOBILIÁRIOS LTDA.,61384004
509.0,CELCOIN IP S.A.,CELCOIN INSTITUICAO DE PAGAMENTO S.A.,13935893
510.0,FFCRED SCD S.A.,FFCRED SOCIEDADE DE CRÉDITO DIRETO S.A..,39738065
511.0,MAGNUM SCD,MAGNUM SOCIEDADE DE CRÉDITO DIRETO S.A.,44683140
512.0,FINVEST DTVM,FINVEST DISTRIBUIDORA DE TÍTULOS E VALORES MOBILIÁRIOS LTDA.,36266751
513.0,ATF CREDIT SCD S.A.,ATF CREDIT SOCIEDADE DE CRÉDITO DIRETO S.A.,44728700
516.0,QISTA S.A. CFI,"QISTA S.A. - CRÉDITO, FINANCIAMENTO E INVESTIMENTO",36583700
518.0,MERCADO CRÉDITO SCFI S.A.,"MERCADO CRÉDITO SOCIEDADE DE CRÉDITO, FINANCIAMENTO E INVESTIMENTO S.A.",37679449
519.0,LIONS TRUST DTVM,LIONS TRUST DISTRIBUIDORA DE TÍTULOS E VALORES MOBILIÁRIOS LTDA.,40768766
521.0,PEAK SEP S.A.,PEAK SOCIEDADE DE EMPRÉSTIMO ENTRE PESSOAS S.A.,44019481
522.0,RED SCD S.A.,RED SOCIEDADE DE CRÉDITO DIRETO S.A.,47593544
523.0,HR DIGITAL SCD,HR DIGITAL - SOCIEDADE DE CRÉDITO DIRETO S/A,44292580
524.0,WNT CAPITAL DTVM,WNT CAPITAL DISTRIBUIDORA DE TÍTULOS E VALORES MOBILIÁRIOS S.A.,45854066
525.0,INTERCAM CC LTDA,INTERCAM CORRETORA DE CÂMBIO LTDA.,34265629
526.0,MONETARIE SCD,MONETARIE SOCIEDADE DE CRÉDITO DIRETO S.A.,46026562
527.0,ATICCA SCD S.A.,ATICCA - SOCIEDADE DE CRÉDITO DIRETO S.A.,44478623
528.0,REAG DTVM S.A.,REAG DISTRIBUIDORA DE TÍTULOS E VALORES MOBILIÁRIOS S.A.,34829992
529.0,PINBANK IP,PINBANK BRASIL INSTITUIÇÃO DE PAGAMENTO S.A.,17079937
530.0,SER FINANCE SCD S.A.,SER FINANCE SOCIEDADE DE CRÉDITO DIRETO S.A.,47873449
532.0,EAGLE SCD S.A.,EAGLE SOCIEDADE DE CRÉDITO DIRETO S.A.,45745537
534.0,EWALLY IP S.A.,EWALLY INSTITUIÇÃO DE PAGAMENTO S.A.,00714671
535.0,MARU SCD S.A.,MARÚ SOCIEDADE DE CRÉDITO DIRETO S.A.,39519944
536.0,NEON PAGAMENTOS S.A. IP,NEON PAGAMENTOS S.A. - INSTITUIÇÃO DE PAGAMENTO,20855875
537.0,MICROCASH SCMEPP LTDA.,MICROCASH SOCIEDADE DE CRÉDITO AO MICROEMPREENDEDOR E À EMPRESA DE PEQUENO PORTE,45756448
539.0,SANTINVEST S.A. - CFI,"SANTINVEST S.A. - CREDITO, FINANCIAMENTO E INVESTIMENTOS",00122327
541.0,FDO GARANTIDOR CRÉDITOS,FUNDO GARANTIDOR DE CREDITOS - FGC,00954288
545.0,SENSO CCVM S.A.,SENSO CORRETORA DE CAMBIO E VALORES MOBILIARIOS S.A,17352220
546.0,U4C INSTITUIÇÃO DE PAGAMENTO S.A.,U4C INSTITUIÇÃO DE PAGAMENTO S.A.,30980539
600.0,BCO LUSO BRASILEIRO S.A.,Banco Luso Brasileiro S.A.,59118133
604.0,BCO INDUSTRIAL DO BRASIL S.A.,Banco Industrial do Brasil S.A.,31895683
610.0,BCO VR S.A.,Banco VR S.A.,78626983
611.0,BCO PAULISTA S.A.,Banco Paulista S.A.,61820817
612.0,BCO GUANABARA S.A.,Banco Guanabara S.A.,31880826
613.0,OMNI BANCO S.A.,Omni Banco S.A.,60850229
623.0,BANCO PAN,Banco Pan S.A.,59285411
626.0,BCO C6 CONSIG,BANCO C6 CONSIGNADO S.A.,61348538
630.0,BCO LETSBANK S.A.,BANCO LETSBANK S.A.,58497702
633.0,BCO RENDIMENTO S.A.,Banco Rendimento S.A.,68900810
634.0,BCO TRIANGULO S.A.,BANCO TRIANGULO S.A.,17351180
637.0,BCO SOFISA S.A.,BANCO SOFISA S.A.,60889128
643.0,BCO PINE S.A.,Banco Pine S.A.,62144175
653.0,BANCO VOITER,BANCO VOITER S.A.,61024352
654.0,BCO DIGIMAIS S.A.,BANCO DIGIMAIS S.A.,92874270
655.0,BCO VOTORANTIM S.A.,Banco Votorantim S.A.,59588111
707.0,BCO DAYCOVAL S.A,Banco Daycoval S.A.,62232889
712.0,BCO OURINVEST S.A.,Banco Ourinvest S.A.,78632767
720.0,BCO RNX S.A.,BANCO RNX S.A.,80271455
739.0,BCO CETELEM S.A.,Banco Cetelem S.A.,00558456
