código,nome,nome completo,ispb
741.0,BCO RIBEIRAO PRETO S.A.,BANCO RIBEIRAO PRETO S.A.,00517645
743.0,BANCO SEMEAR,Banco Semear S.A.,00795423
745.0,BCO CITIBANK S.A.,Banco Citibank S.A.,33479023
746.0,BCO MODAL S.A.,Banco Modal S.A.,30723886
747.0,BCO RABOBANK INTL BRASIL S.A.,Banco Rabobank International Brasil S.A.,01023570
748.0,BCO COOPERATIVO SICREDI S.A.,BANCO COOPERATIVO SICREDI S.A.,01181521
751.0,SCOTIABANK BRASIL,Scotiabank Brasil S.A. Banco Múltiplo,29030467
752.0,BCO BNP PARIBAS BRASIL S A,Banco BNP Paribas Brasil S.A.,01522368
753.0,NOVO BCO CONTINENTAL S.A. - BM,Novo Banco Continental S.A. - Banco Múltiplo,74828799
754.0,BANCO SISTEMA,Banco Sistema S.A.,76543115
755.0,BOFA MERRILL LYNCH BM S.A.,Bank of America Merrill Lynch Banco Múltiplo S.A.,62073200
756.0,BANCO SICOOB S.A.,BANCO COOPERATIVO SICOOB S.A. - BANCO SICOOB,02038232
757.0,BCO KEB HANA DO BRASIL S.A.,BANCO KEB HANA DO BRASIL S.A.,02318507
,Selic,Banco Central do Brasil - Selic,00038121
,Bacen,Banco Central do Brasil,00038166
,STN,Secretaria do Tesouro Nacional - STN,00394460
,CIP SA Siloc,CIP S.A,02992335
,CAMARA INTERBANCARIA DE PAGAMENTOS - CIP,CIP S.A,04391007
,Balcão B3,Sistema do Balcão B3,28719664
,CIP SA C3,CIP S.A,29011780
,Câmara B3,Câmara B3,54641030
,Câmbio B3,Câmara de Câmbio B3,60934221
